257568,Spain,ESP,"Educational attainment, Doctoral or equivalent, population 25+, male (%) (cumulative)",
257569,Spain,ESP,"Educational attainment, Doctoral or equivalent, population 25+, total (%) (cumulative)",
257570,Spain,ESP,Electric power consumption (kWh per capita),5167.809673
257571,Spain,ESP,Electric power transmission and distribution losses (% of output),8.720764436
257572,Spain,ESP,Electricity production from coal sources (% of total),36.60041372
257573,Spain,ESP,Electricity production from hydroelectric sources (% of total),12.79009239
257574,Spain,ESP,Electricity production from natural gas sources (% of total),9.133581688
257575,Spain,ESP,Electricity production from nuclear sources (% of total),28.15757669
257576,Spain,ESP,Electricity production from oil sources (% of total),10.21994288
257577,Spain,ESP,"Electricity production from oil, gas and coal sources (% of total)",55.95393829
257578,Spain,ESP,"Electricity production from renewable sources, excluding hydroelectric (% of total)",2.823633788
257579,Spain,ESP,"Electricity production from renewable sources, excluding hydroelectric (kWh)",6238000000.0
257580,Spain,ESP,"Employers, female (% of female employment) (modeled ILO estimate)",3.358999968
257581,Spain,ESP,"Employers, male (% of male employment) (modeled ILO estimate)",6.928999901
257582,Spain,ESP,"Employers, total (% of total employment) (modeled ILO estimate)",5.627999783
257583,Spain,ESP,Employment in agriculture (% of total employment) (modeled ILO estimate),6.6880002020000004
257584,Spain,ESP,"Employment in agriculture, female (% of female employment) (modeled ILO estimate)",4.767000198
257585,Spain,ESP,"Employment in agriculture, male (% of male employment) (modeled ILO estimate)",7.789000034
257586,Spain,ESP,Employment in industry (% of total employment) (modeled ILO estimate),30.82699966
257587,Spain,ESP,"Employment in industry, female (% of female employment) (modeled ILO estimate)",14.44299984
257588,Spain,ESP,"Employment in industry, male (% of male employment) (modeled ILO estimate)",40.21500015
257589,Spain,ESP,Employment in services (% of total employment) (modeled ILO estimate),62.48500061
257590,Spain,ESP,"Employment in services, female (% of female employment) (modeled ILO estimate)",80.79000092
257591,Spain,ESP,"Employment in services, male (% of male employment) (modeled ILO estimate)",51.99599838
257592,Spain,ESP,"Employment to population ratio, 15+, female (%) (modeled ILO estimate)",32.33499908
257593,Spain,ESP,"Employment to population ratio, 15+, female (%) (national estimate)",32.429401399999996
257594,Spain,ESP,"Employment to population ratio, 15+, male (%) (modeled ILO estimate)",59.49000168
257595,Spain,ESP,"Employment to population ratio, 15+, male (%) (national estimate)",59.36019897
257596,Spain,ESP,"Employment to population ratio, 15+, total (%) (modeled ILO estimate)",45.55400085
257597,Spain,ESP,"Employment to population ratio, 15+, total (%) (national estimate)",45.49629974
257598,Spain,ESP,"Employment to population ratio, ages 15-24, female (%) (modeled ILO estimate)",26.83600044
257599,Spain,ESP,"Employment to population ratio, ages 15-24, female (%) (national estimate)",26.78650093
257600,Spain,ESP,"Employment to population ratio, ages 15-24, male (%) (modeled ILO estimate)",37.68299866
257601,Spain,ESP,"Employment to population ratio, ages 15-24, male (%) (national estimate)",37.51919937
257602,Spain,ESP,"Employment to population ratio, ages 15-24, total (%) (modeled ILO estimate)",32.40599823
257603,Spain,ESP,"Employment to population ratio, ages 15-24, total (%) (national estimate)",32.22729874
257604,Spain,ESP,"Energy imports, net (% of energy use)",74.10016865
257605,Spain,ESP,Energy intensity level of primary energy (MJ/$2011 PPP GDP),4.136924937
257606,Spain,ESP,Energy related methane emissions (% of total),12.18868436
257607,Spain,ESP,Energy use (kg of oil equivalent per capita),3003.761672
257608,Spain,ESP,"Energy use (kg of oil equivalent) per $1,000 GDP (constant 2017 PPP)",86.24983541
257609,Spain,ESP,Exclusive breastfeeding (% of children under 6 months),
257610,Spain,ESP,Expenditure on primary education (% of government expenditure on education),25.826179999999997
257611,Spain,ESP,Expenditure on secondary education (% of government expenditure on education),43.74455
257612,Spain,ESP,Expenditure on tertiary education (% of government expenditure on education),21.78937
257613,Spain,ESP,Expense (% of GDP),20.09813985
257614,Spain,ESP,Expense (current LCU),130206000000.0
257615,Spain,ESP,Export unit value index (2000 = 100),100.0
257616,Spain,ESP,Export value index (2000 = 100),100.0
257617,Spain,ESP,Export volume index (2000 = 100),100.0
257618,Spain,ESP,Exports as a capacity to import (constant LCU),222000000000.0
257619,Spain,ESP,Exports of goods and services (% of GDP),28.56335793
257620,Spain,ESP,Exports of goods and services (annual % growth),10.43821013
257621,Spain,ESP,"Exports of goods and services (BoP, current US$)",170406000000.0
257622,Spain,ESP,Exports of goods and services (constant 2010 US$),292626000000.0
257623,Spain,ESP,Exports of goods and services (constant LCU),231431000000.0
257624,Spain,ESP,Exports of goods and services (current LCU),185048000000.0
257625,Spain,ESP,Exports of goods and services (current US$),170488000000.0
257626,Spain,ESP,"Exports of goods, services and primary income (BoP, current US$)",194162000000.0
257627,Spain,ESP,External balance on goods and services (% of GDP),-2.9556178810000002
257628,Spain,ESP,External balance on goods and services (constant LCU),-13541000000.0
257629,Spain,ESP,External balance on goods and services (current LCU),-19148000000.0
257630,Spain,ESP,External balance on goods and services (current US$),-17641422517.0
257631,Spain,ESP,External debt stocks (% of GNI),
257632,Spain,ESP,"External debt stocks, long-term (DOD, current US$)",
257633,Spain,ESP,"External debt stocks, private nonguaranteed (PNG) (DOD, current US$)",
257634,Spain,ESP,"External debt stocks, public and publicly guaranteed (PPG) (DOD, current US$)",
257635,Spain,ESP,"External debt stocks, short-term (DOD, current US$)",
257636,Spain,ESP,"External debt stocks, total (DOD, current US$)",
257637,Spain,ESP,External health expenditure (% of current health expenditure),0.0
257638,Spain,ESP,External health expenditure per capita (current US$),0.0
257639,Spain,ESP,"External health expenditure per capita, PPP (current international $)",0.0
257640,Spain,ESP,Female genital mutilation prevalence (%),
257641,Spain,ESP,Female headed households (% of households with a female head),
257642,Spain,ESP,Female share of employment in senior and middle management (%),15.64999962
257643,Spain,ESP,"Fertility rate, total (births per woman)",1.22
257644,Spain,ESP,Fertilizer consumption (% of fertilizer production),
257645,Spain,ESP,Fertilizer consumption (kilograms per hectare of arable land),
257646,Spain,ESP,Final consumption expenditure (% of GDP),76.31523298
257647,Spain,ESP,Final consumption expenditure (annual % growth),4.4539784010000005
257648,Spain,ESP,Final consumption expenditure (constant 2010 US$),857382000000.0
257649,Spain,ESP,Final consumption expenditure (constant LCU),673185000000.0
257650,Spain,ESP,Final consumption expenditure (current LCU),494409000000.0
257651,Spain,ESP,Final consumption expenditure (current US$),455509000000.0
257652,Spain,ESP,Financial intermediary services indirectly Measured (FISIM) (constant LCU),
257653,Spain,ESP,Financial intermediary services indirectly Measured (FISIM) (current LCU),
257654,Spain,ESP,Firms competing against unregistered firms (% of firms),
257655,Spain,ESP,Firms expected to give gifts in meetings with tax officials (% of firms),
257656,Spain,ESP,Firms experiencing electrical outages (% of firms),
257657,Spain,ESP,Firms experiencing losses due to theft and vandalism (% of firms),
257658,Spain,ESP,Firms formally registered when operations started (% of firms),
257659,Spain,ESP,Firms offering formal training (% of firms),
257660,Spain,ESP,Firms that do not report all sales for tax purposes (% of firms),
257661,Spain,ESP,Firms that spend on R&D (% of firms),
257662,Spain,ESP,Firms using banks to finance investment (% of firms),
257663,Spain,ESP,Firms using banks to finance working capital (% of firms),
257664,Spain,ESP,Firms visited or required meetings with tax officials (% of firms),
257665,Spain,ESP,Firms with female participation in ownership (% of firms),
257666,Spain,ESP,Firms with female top manager (% of firms),
257667,Spain,ESP,"Fish species, threatened",
257668,Spain,ESP,Fixed broadband subscriptions,76358.0
257669,Spain,ESP,Fixed broadband subscriptions (per 100 people),0.187038482
257670,Spain,ESP,Fixed telephone subscriptions,17104000.0
257671,Spain,ESP,Fixed telephone subscriptions (per 100 people),41.89614958
257672,Spain,ESP,Food exports (% of merchandise exports),13.54939814
257673,Spain,ESP,Food imports (% of merchandise imports),9.155255602999999
257674,Spain,ESP,Food production index (2004-2006 = 100),99.96
257675,Spain,ESP,"Food, beverages and tobacco (% of value added in manufacturing)",14.13827945
257676,Spain,ESP,"Foreign direct investment, net (BoP, current US$)",18579389803.0
257677,Spain,ESP,"Foreign direct investment, net inflows (% of GDP)",6.786943902000001
257678,Spain,ESP,"Foreign direct investment, net inflows (BoP, current US$)",40509751188.0
257679,Spain,ESP,"Foreign direct investment, net outflows (% of GDP)",9.899712122
257680,Spain,ESP,"Foreign direct investment, net outflows (BoP, current US$)",59089168951.0
257681,Spain,ESP,Forest area (% of land area),34.02192275
257682,Spain,ESP,Forest area (sq. km),169769.3945
257683,Spain,ESP,Forest rents (% of GDP),0.033825958999999996
257684,Spain,ESP,Fossil fuel energy consumption (% of total),80.63494269
257685,Spain,ESP,Fuel exports (% of merchandise exports),3.5644257360000005
257686,Spain,ESP,Fuel imports (% of merchandise imports),12.17739181
257687,Spain,ESP,GDP (constant 2010 US$),1152480000000.0
257688,Spain,ESP,GDP (constant LCU),875272000000.0
257689,Spain,ESP,GDP (current LCU),647851000000.0
257690,Spain,ESP,GDP (current US$),596878000000.0
257691,Spain,ESP,GDP deflator (base year varies by country),74.01710554
257692,Spain,ESP,GDP deflator: linked series (base year varies by country),74.01710554
257693,Spain,ESP,GDP growth (annual %),5.24599468
257694,Spain,ESP,GDP per capita (constant 2010 US$),28408.80677
257695,Spain,ESP,GDP per capita (constant LCU),21575.50124
257696,Spain,ESP,GDP per capita (current LCU),15969.56152
257697,Spain,ESP,GDP per capita (current US$),14713.065709999999
257698,Spain,ESP,GDP per capita growth (annual %),4.776451415
257699,Spain,ESP,"GDP per capita, PPP (constant 2017 international $)",34826.288739999996
257700,Spain,ESP,"GDP per capita, PPP (current international $)",21592.33515
257701,Spain,ESP,GDP per person employed (constant 2017 PPP $),89664.18963
257702,Spain,ESP,GDP per unit of energy use (constant 2017 PPP $ per kg of oil equivalent),11.59422502
257703,Spain,ESP,GDP per unit of energy use (PPP $ per kg of oil equivalent),7.188431542999999
257704,Spain,ESP,"GDP, PPP (constant 2017 international $)",1412830000000.0
257705,Spain,ESP,"GDP, PPP (current international $)",875955000000.0
257706,Spain,ESP,GDP: linked series (current LCU),647851000000.0
257707,Spain,ESP,General government final consumption expenditure (% of GDP),16.69782095
257708,Spain,ESP,General government final consumption expenditure (annual % growth),4.515868384
257709,Spain,ESP,General government final consumption expenditure (constant 2010 US$),185244000000.0
257710,Spain,ESP,General government final consumption expenditure (constant LCU),139698000000.0
257711,Spain,ESP,General government final consumption expenditure (current LCU),108177000000.0
257712,Spain,ESP,General government final consumption expenditure (current US$),99665561083.0
257713,Spain,ESP,GHG net emissions/removals by LUCF (Mt of CO2 equivalent),-23.280881899999997
257714,Spain,ESP,Gini index (World Bank estimate),34.3
257715,Spain,ESP,GNI (constant 2010 US$),1144570000000.0
257716,Spain,ESP,GNI (constant LCU),869154000000.0
257717,Spain,ESP,GNI (current LCU),643218000000.0
257718,Spain,ESP,GNI (current US$),592609000000.0
257719,Spain,ESP,GNI growth (annual %),5.457709056000001
257720,Spain,ESP,GNI per capita (constant 2010 US$),28213.59723
257721,Spain,ESP,GNI per capita (constant LCU),21424.69187
257722,Spain,ESP,GNI per capita (current LCU),15855.35783
257723,Spain,ESP,GNI per capita growth (annual %),4.987221251
257724,Spain,ESP,"GNI per capita, Atlas method (current US$)",15770.0
257725,Spain,ESP,"GNI per capita, PPP (constant 2017 international $)",34582.84637
257726,Spain,ESP,"GNI per capita, PPP (current international $)",21440.0
257727,Spain,ESP,"GNI, Atlas method (current US$)",639777000000.0
257728,Spain,ESP,"GNI, PPP (constant 2017 international $)",1402950000000.0
257729,Spain,ESP,"GNI, PPP (current international $)",869691000000.0
257730,Spain,ESP,GNI: linked series (current LCU),643218000000.0
257731,Spain,ESP,Goods and services expense (% of expense),3.5190390610000004
257732,Spain,ESP,Goods and services expense (current LCU),4582000000.0
257733,Spain,ESP,"Goods exports (BoP, current US$)",117681000000.0
257734,Spain,ESP,"Goods imports (BoP, current US$)",155780000000.0
257735,Spain,ESP,"Government expenditure on education, total (% of GDP)",4.166049957
257736,Spain,ESP,"Government expenditure on education, total (% of government expenditure)",10.66263008
257737,Spain,ESP,"Government expenditure per student, primary (% of GDP per capita)",17.22694
257738,Spain,ESP,"Government expenditure per student, secondary (% of GDP per capita)",22.833000000000002
257739,Spain,ESP,"Government expenditure per student, tertiary (% of GDP per capita)",20.18436
257740,Spain,ESP,Grants and other revenue (% of revenue),11.59079185
257741,Spain,ESP,Grants and other revenue (current LCU),14380000000.0
257742,Spain,ESP,"Grants, excluding technical cooperation (BoP, current US$)",
257743,Spain,ESP,Gross capital formation (% of GDP),26.640384899999997
257744,Spain,ESP,Gross capital formation (annual % growth),7.047576815
257745,Spain,ESP,Gross capital formation (constant 2010 US$),298076000000.0
257746,Spain,ESP,Gross capital formation (constant LCU),207607000000.0
257747,Spain,ESP,Gross capital formation (current LCU),172590000000.0
257748,Spain,ESP,Gross capital formation (current US$),159011000000.0
257749,Spain,ESP,Gross domestic income (constant LCU),865841000000.0
257750,Spain,ESP,Gross domestic savings (% of GDP),23.68476702
257751,Spain,ESP,Gross domestic savings (current LCU),153442000000.0
257752,Spain,ESP,Gross domestic savings (current US$),141369000000.0
257753,Spain,ESP,Gross fixed capital formation (% of GDP),25.94084134
257754,Spain,ESP,Gross fixed capital formation (annual % growth),7.5250979760000005
257755,Spain,ESP,Gross fixed capital formation (constant 2010 US$),287068000000.0
257756,Spain,ESP,Gross fixed capital formation (constant LCU),200287000000.0
257757,Spain,ESP,Gross fixed capital formation (current LCU),168058000000.0
257758,Spain,ESP,Gross fixed capital formation (current US$),154835000000.0
257759,Spain,ESP,"Gross fixed capital formation, private sector (% of GDP)",
257760,Spain,ESP,"Gross fixed capital formation, private sector (current LCU)",
257761,Spain,ESP,"Gross intake ratio in first grade of primary education, female (% of relevant age group)",101.97527
257762,Spain,ESP,"Gross intake ratio in first grade of primary education, male (% of relevant age group)",101.79231999999999
257763,Spain,ESP,"Gross intake ratio in first grade of primary education, total (% of relevant age group)",101.88117
257764,Spain,ESP,Gross national expenditure (% of GDP),102.95561790000001
257765,Spain,ESP,Gross national expenditure (constant 2010 US$),1155460000000.0
257766,Spain,ESP,Gross national expenditure (constant LCU),880792000000.0
257767,Spain,ESP,Gross national expenditure (current LCU),666999000000.0
257768,Spain,ESP,Gross national expenditure (current US$),614519000000.0
257769,Spain,ESP,Gross national expenditure deflator (base year varies by country),75.72718644
257770,Spain,ESP,Gross savings (% of GDP),22.32755807
257771,Spain,ESP,Gross savings (% of GNI),22.48838002
257772,Spain,ESP,Gross savings (current LCU),144649000000.0
257773,Spain,ESP,Gross savings (current US$),133268000000.0
257774,Spain,ESP,Gross value added at basic prices (GVA) (constant 2010 US$),1054490000000.0
257775,Spain,ESP,Gross value added at basic prices (GVA) (constant LCU),794532000000.0
257776,Spain,ESP,Gross value added at basic prices (GVA) (current LCU),588988000000.0
257777,Spain,ESP,Gross value added at basic prices (GVA) (current US$),542646000000.0
257778,Spain,ESP,HFC gas emissions (thousand metric tons of CO2 equivalent),3296.8
257779,Spain,ESP,High-technology exports (% of manufactured exports),
257780,Spain,ESP,High-technology exports (current US$),
257781,Spain,ESP,"Hospital beds (per 1,000 people)",3.7
257782,Spain,ESP,Households and NPISHs final consumption expenditure (% of GDP),59.61741203
257783,Spain,ESP,Households and NPISHs Final consumption expenditure (annual % growth),4.436379088
257784,Spain,ESP,Households and NPISHs Final consumption expenditure (constant 2010 US$),672657000000.0
257785,Spain,ESP,Households and NPISHs Final consumption expenditure (constant LCU),535791000000.0
257786,Spain,ESP,Households and NPISHs Final consumption expenditure (current LCU),386232000000.0
257787,Spain,ESP,Households and NPISHs Final consumption expenditure (current US$),355843000000.0
257788,Spain,ESP,Households and NPISHs Final consumption expenditure per capita (constant 2010 US$),16581.037640000002
257789,Spain,ESP,Households and NPISHs Final consumption expenditure per capita growth (annual %),3.970447832
257790,Spain,ESP,"Households and NPISHs Final consumption expenditure, PPP (constant 2017 international $)",770741000000.0
257791,Spain,ESP,"Households and NPISHs Final consumption expenditure, PPP (current international $)",502293000000.0
257792,Spain,ESP,Households and NPISHs final consumption expenditure: linked series (current LCU),386232000000.0
257793,Spain,ESP,Human capital index (HCI) (scale 0-1),
257794,Spain,ESP,"Human capital index (HCI), female (scale 0-1)",
257795,Spain,ESP,"Human capital index (HCI), female, lower bound (scale 0-1)",
257796,Spain,ESP,"Human capital index (HCI), female, upper bound (scale 0-1)",
257797,Spain,ESP,"Human capital index (HCI), lower bound (scale 0-1)",
257798,Spain,ESP,"Human capital index (HCI), male (scale 0-1)",
257799,Spain,ESP,"Human capital index (HCI), male, lower bound (scale 0-1)",
257800,Spain,ESP,"Human capital index (HCI), male, upper bound (scale 0-1)",
257801,Spain,ESP,"Human capital index (HCI), upper bound (scale 0-1)",
257802,Spain,ESP,"IBRD loans and IDA credits (DOD, current US$)",
257803,Spain,ESP,ICT goods exports (% of total goods exports),4.724931133
257804,Spain,ESP,ICT goods imports (% total goods imports),8.47437793
257805,Spain,ESP,"ICT service exports (% of service exports, BoP)",
257806,Spain,ESP,"ICT service exports (BoP, current US$)",
257807,Spain,ESP,IDA resource allocation index (1=low to 6=high),
257808,Spain,ESP,"IFC, private nonguaranteed (NFL, current US$)",
257809,Spain,ESP,"IMF repurchases and charges (TDS, current US$)",
257810,Spain,ESP,"Immunization, DPT (% of children ages 12-23 months)",95.0
257811,Spain,ESP,"Immunization, HepB3 (% of one-year-old children)",77.0
257812,Spain,ESP,"Immunization, measles (% of children ages 12-23 months)",94.0
257813,Spain,ESP,Import unit value index (2000 = 100),100.0
257814,Spain,ESP,Import value index (2000 = 100),100.0
257815,Spain,ESP,Import volume index (2000 = 100),100.0
257816,Spain,ESP,Imports of goods and services (% of GDP),31.51897581
257817,Spain,ESP,Imports of goods and services (annual % growth),9.570880335
257818,Spain,ESP,"Imports of goods and services (BoP, current US$)",188134000000.0
257819,Spain,ESP,Imports of goods and services (constant 2010 US$),298600000000.0
257820,Spain,ESP,Imports of goods and services (constant LCU),244972000000.0
257821,Spain,ESP,Imports of goods and services (current LCU),204196000000.0
257822,Spain,ESP,Imports of goods and services (current US$),188130000000.0
257823,Spain,ESP,"Imports of goods, services and primary income (BoP, current US$)",216259000000.0
257824,Spain,ESP,"Incidence of HIV, ages 15-49 (per 1,000 uninfected population ages 15-49)",0.21
257825,Spain,ESP,"Incidence of malaria (per 1,000 population at risk)",
257826,Spain,ESP,"Incidence of tuberculosis (per 100,000 people)",23.0
257827,Spain,ESP,Income share held by fourth 20%,22.5
257828,Spain,ESP,Income share held by highest 10%,26.3
257829,Spain,ESP,Income share held by highest 20%,41.6
257830,Spain,ESP,Income share held by lowest 10%,2.7
257831,Spain,ESP,Income share held by lowest 20%,7.1
257832,Spain,ESP,Income share held by second 20%,12.2
257833,Spain,ESP,Income share held by third 20%,16.5
257834,Spain,ESP,Increase in poverty gap at $1.90 ($ 2011 PPP) poverty line due to out-of-pocket health care expenditure (% of poverty line),
257835,Spain,ESP,Increase in poverty gap at $1.90 ($ 2011 PPP) poverty line due to out-of-pocket health care expenditure (USD),
257836,Spain,ESP,Increase in poverty gap at $3.20 ($ 2011 PPP) poverty line due to out-of-pocket health care expenditure (% of poverty line),
257837,Spain,ESP,Increase in poverty gap at $3.20 ($ 2011 PPP) poverty line due to out-of-pocket health care expenditure (USD),
257838,Spain,ESP,Individuals using the Internet (% of population),13.62496081
257839,Spain,ESP,"Industrial design applications, nonresident, by count",
257840,Spain,ESP,"Industrial design applications, resident, by count",
257841,Spain,ESP,"Industry (including construction), value added (% of GDP)",27.96923984
257842,Spain,ESP,"Industry (including construction), value added (annual % growth)",5.192316821
257843,Spain,ESP,"Industry (including construction), value added (constant 2010 US$)",324101000000.0
257844,Spain,ESP,"Industry (including construction), value added (constant LCU)",243759000000.0
257845,Spain,ESP,"Industry (including construction), value added (current LCU)",181199000000.0
257846,Spain,ESP,"Industry (including construction), value added (current US$)",166942000000.0
257847,Spain,ESP,"Industry (including construction), value added per worker (constant 2010 US$)",66723.41197
257848,Spain,ESP,"Inflation, consumer prices (annual %)",3.433516755
257849,Spain,ESP,"Inflation, GDP deflator (annual %)",3.329704778
257850,Spain,ESP,"Inflation, GDP deflator: linked series (annual %)",3.329704778
257851,Spain,ESP,Informal employment (% of total non-agricultural employment),
257852,Spain,ESP,"Informal employment, female (% of total non-agricultural employment)",
257853,Spain,ESP,"Informal employment, male (% of total non-agricultural employment)",
257854,Spain,ESP,Informal payments to public officials (% of firms),
257855,Spain,ESP,Insurance and financial services (% of commercial service exports),
257856,Spain,ESP,Insurance and financial services (% of commercial service imports),
257857,Spain,ESP,"Insurance and financial services (% of service exports, BoP)",
257858,Spain,ESP,"Insurance and financial services (% of service imports, BoP)",
257859,Spain,ESP,"Intentional homicides (per 100,000 people)",1.354570616
257860,Spain,ESP,"Intentional homicides, female (per 100,000 female)",
257861,Spain,ESP,"Intentional homicides, male (per 100,000 male)",
257862,Spain,ESP,Interest payments (% of expense),13.06468212
257863,Spain,ESP,Interest payments (% of revenue),13.7114715
257864,Spain,ESP,Interest payments (current LCU),17011000000.0
257865,Spain,ESP,"Interest rate spread (lending rate minus deposit rate, %)",
257866,Spain,ESP,"Internally displaced persons, new displacement associated with conflict and violence (number of cases)",
257867,Spain,ESP,"Internally displaced persons, new displacement associated with disasters (number of cases)",
257868,Spain,ESP,"Internally displaced persons, total displaced by conflict and violence (number of people)",
257869,Spain,ESP,International migrant stock (% of population),4.066977016
257870,Spain,ESP,"International migrant stock, total",1657285.0
257871,Spain,ESP,"International tourism, expenditures (% of total imports)",3.172733498
257872,Spain,ESP,"International tourism, expenditures (current US$)",5969000000.0
257873,Spain,ESP,"International tourism, expenditures for passenger transport items (current US$)",
257874,Spain,ESP,"International tourism, expenditures for travel items (current US$)",5969000000.0
257875,Spain,ESP,"International tourism, number of arrivals",46403000.0
257876,Spain,ESP,"International tourism, number of departures",4100000.0
257877,Spain,ESP,"International tourism, receipts (% of total exports)",18.50174586
257878,Spain,ESP,"International tourism, receipts (current US$)",31528000000.0
257879,Spain,ESP,"International tourism, receipts for passenger transport items (current US$)",
257880,Spain,ESP,"International tourism, receipts for travel items (current US$)",31528000000.0
257881,Spain,ESP,Investment in energy with private participation (current US$),
257882,Spain,ESP,Investment in ICT with private participation (current US$),
257883,Spain,ESP,Investment in transport with private participation (current US$),
257884,Spain,ESP,Investment in water and sanitation with private participation (current US$),
257885,Spain,ESP,"Labor force participation rate for ages 15-24, female (%) (modeled ILO estimate)",39.59199905
