98699,France,FRA,"Personal remittances, paid (current US$)",5120657542.0
98700,France,FRA,"Personal remittances, received (% of GDP)",0.6510962379999999
98701,France,FRA,"Personal remittances, received (current US$)",8869551607.0
98702,France,FRA,"Personal transfers, receipts (BoP, current US$)",679063558.7
98703,France,FRA,PFC gas emissions (thousand metric tons of CO2 equivalent),1136.3
98704,France,FRA,"Physicians (per 1,000 people)",3.3547
98705,France,FRA,"Plant species (higher), threatened",
98706,France,FRA,"PM2.5 air pollution, mean annual exposure (micrograms per cubic meter)",14.72301795
98707,France,FRA,"PM2.5 air pollution, population exposed to levels exceeding WHO guideline value (% of total)",99.37341424
98708,France,FRA,"PM2.5 pollution, population exposed to levels exceeding WHO Interim Target-1 value (% of total)",0.0
98709,France,FRA,"PM2.5 pollution, population exposed to levels exceeding WHO Interim Target-2 value (% of total)",0.0
98710,France,FRA,"PM2.5 pollution, population exposed to levels exceeding WHO Interim Target-3 value (% of total)",40.14578789
98711,France,FRA,"PNG, bonds (NFL, current US$)",
98712,France,FRA,"PNG, commercial banks and other creditors (NFL, current US$)",
98713,France,FRA,"Population ages 00-04, female (% of female population)",5.892095423
98714,France,FRA,"Population ages 00-04, male (% of male population)",6.580229582
98715,France,FRA,Population ages 0-14 (% of total population),18.90702338
98716,France,FRA,"Population ages 0-14, female",5620546.0
98717,France,FRA,"Population ages 0-14, female (% of female population)",17.91882281
98718,France,FRA,"Population ages 0-14, male",5896192.0
98719,France,FRA,"Population ages 0-14, male (% of male population)",19.95611597
98720,France,FRA,"Population ages 0-14, total",11516741.0
98721,France,FRA,"Population ages 05-09, female (% of female population)",5.833190494
98722,France,FRA,"Population ages 05-09, male (% of male population)",6.501670105
98723,France,FRA,"Population ages 10-14, female (% of female population)",6.193536898
98724,France,FRA,"Population ages 10-14, male (% of male population)",6.874216279
98725,France,FRA,"Population ages 15-19, female (% of female population)",6.305084755
98726,France,FRA,"Population ages 15-19, male (% of male population)",6.930631122
98727,France,FRA,Population ages 15-64 (% of total population),65.03560716
98728,France,FRA,"Population ages 15-64, female",19918366.0
98729,France,FRA,"Population ages 15-64, female (% of female population)",63.50160632
98730,France,FRA,"Population ages 15-64, male",19696452.0
98731,France,FRA,"Population ages 15-64, male (% of male population)",66.6641619
98732,France,FRA,"Population ages 15-64, total",39614814.0
98733,France,FRA,"Population ages 20-24, female (% of female population)",6.038368922
98734,France,FRA,"Population ages 20-24, male (% of male population)",6.503657847
98735,France,FRA,"Population ages 25-29, female (% of female population)",6.827236262
98736,France,FRA,"Population ages 25-29, male (% of male population)",7.263922011
98737,France,FRA,"Population ages 30-34, female (% of female population)",7.066258453
98738,France,FRA,"Population ages 30-34, male (% of male population)",7.432635545
98739,France,FRA,"Population ages 35-39, female (% of female population)",7.238757989
98740,France,FRA,"Population ages 35-39, male (% of male population)",7.5512468020000005
98741,France,FRA,"Population ages 40-44, female (% of female population)",7.008775061000001
98742,France,FRA,"Population ages 40-44, male (% of male population)",7.267935922
98743,France,FRA,"Population ages 45-49, female (% of female population)",6.948734877000001
98744,France,FRA,"Population ages 45-49, male (% of male population)",7.246542367999999
98745,France,FRA,"Population ages 50-54, female (% of female population)",6.792148655
98746,France,FRA,"Population ages 50-54, male (% of male population)",7.124196672
98747,France,FRA,"Population ages 55-59, female (% of female population)",4.641314195
98748,France,FRA,"Population ages 55-59, male (% of male population)",4.828284766
98749,France,FRA,"Population ages 60-64, female (% of female population)",4.634927151
98750,France,FRA,"Population ages 60-64, male (% of male population)",4.515108848000001
98751,France,FRA,Population ages 65 and above (% of total population),16.05736946
98752,France,FRA,"Population ages 65 and above, female",5827800.0
98753,France,FRA,"Population ages 65 and above, female (% of female population)",18.57957087
98754,France,FRA,"Population ages 65 and above, male",3953144.0
98755,France,FRA,"Population ages 65 and above, male (% of male population)",13.37972213
98756,France,FRA,"Population ages 65 and above, total",9780945.0
98757,France,FRA,"Population ages 65-69, female (% of female population)",4.830174566
98758,France,FRA,"Population ages 65-69, male (% of male population)",4.355817001
98759,France,FRA,"Population ages 70-74, female (% of female population)",4.589539984
98760,France,FRA,"Population ages 70-74, male (% of male population)",3.7336258
98761,France,FRA,"Population ages 75-79, female (% of female population)",4.14741573
98762,France,FRA,"Population ages 75-79, male (% of male population)",2.926644459
98763,France,FRA,"Population ages 80 and above, female (% of female population)",5.012440585
98764,France,FRA,"Population ages 80 and above, male (% of male population)",2.363634871
98765,France,FRA,Population density (people per sq. km of land area),111.2420962
98766,France,FRA,Population growth (annual %),0.684929254
98767,France,FRA,Population in largest city,9736538.0
98768,France,FRA,Population in the largest city (% of urban population),21.06795244
98769,France,FRA,Population in urban agglomerations of more than 1 million,13660076.0
98770,France,FRA,Population in urban agglomerations of more than 1 million (% of total population),22.42573528
98771,France,FRA,Population living in areas where elevation is below 5 meters (% of total population),2.887020155
98772,France,FRA,Population living in slums (% of urban population),
98773,France,FRA,"Population, female",31366712.0
98774,France,FRA,"Population, female (% of total population)",51.4947041
98775,France,FRA,"Population, male",29545788.0
98776,France,FRA,"Population, male (% of total population)",48.5052959
98777,France,FRA,"Population, total",60912500.0
98778,France,FRA,"Portfolio equity, net inflows (BoP, current US$)",49966125577.0
98779,France,FRA,"Portfolio investment, bonds (PPG + PNG) (NFL, current US$)",
98780,France,FRA,"Portfolio investment, net (BoP, current US$)",-34892656441.0
98781,France,FRA,Poverty gap at $1.90 a day (2011 PPP) (%),0.0
98782,France,FRA,Poverty gap at $3.20 a day (2011 PPP) (%),0.0
98783,France,FRA,Poverty gap at $5.50 a day (2011 PPP) (%),0.1
98784,France,FRA,Poverty headcount ratio at $1.90 a day (2011 PPP) (% of population),0.0
98785,France,FRA,Poverty headcount ratio at $3.20 a day (2011 PPP) (% of population),0.2
98786,France,FRA,Poverty headcount ratio at $5.50 a day (2011 PPP) (% of population),0.2
98787,France,FRA,Poverty headcount ratio at national poverty lines (% of population),
98788,France,FRA,Power outages in firms in a typical month (number),
98789,France,FRA,"PPG, bonds (NFL, current US$)",
98790,France,FRA,"PPG, commercial banks (NFL, current US$)",
98791,France,FRA,"PPG, IBRD (DOD, current US$)",
98792,France,FRA,"PPG, IDA (DOD, current US$)",
98793,France,FRA,"PPG, official creditors (NFL, current US$)",
98794,France,FRA,"PPG, other private creditors (NFL, current US$)",
98795,France,FRA,"PPG, private creditors (NFL, current US$)",
98796,France,FRA,"PPP conversion factor, GDP (LCU per international $)",0.9300209999999999
98797,France,FRA,"PPP conversion factor, private consumption (LCU per international $)",0.9357280000000001
98798,France,FRA,Pregnant women receiving prenatal care (%),
98799,France,FRA,"Preprimary education, duration (years)",3.0
98800,France,FRA,"Presence of peace keepers (number of troops, police, and military observers in mandate)",
98801,France,FRA,"Present value of external debt (% of exports of goods, services and primary income)",
98802,France,FRA,Present value of external debt (% of GNI),
98803,France,FRA,Present value of external debt (current US$),
98804,France,FRA,Prevalence of anemia among children (% of children under 5),11.3
98805,France,FRA,Prevalence of anemia among non-pregnant women (% of women ages 15-49),13.8
98806,France,FRA,Prevalence of anemia among pregnant women (%),25.3
98807,France,FRA,Prevalence of anemia among women of reproductive age (% of women ages 15-49),14.2
98808,France,FRA,"Prevalence of HIV, female (% ages 15-24)",
98809,France,FRA,"Prevalence of HIV, male (% ages 15-24)",
98810,France,FRA,"Prevalence of HIV, total (% of population ages 15-49)",0.2
98811,France,FRA,Prevalence of moderate or severe food insecurity in the population (%),
98812,France,FRA,"Prevalence of overweight, weight for height (% of children under 5)",
98813,France,FRA,"Prevalence of overweight, weight for height, female (% of children under 5)",
98814,France,FRA,"Prevalence of overweight, weight for height, male (% of children under 5)",
98815,France,FRA,Prevalence of severe food insecurity in the population (%),
98816,France,FRA,"Prevalence of severe wasting, weight for height (% of children under 5)",
98817,France,FRA,"Prevalence of severe wasting, weight for height, female (% of children under 5)",
98818,France,FRA,"Prevalence of severe wasting, weight for height, male (% of children under 5)",
98819,France,FRA,"Prevalence of stunting, height for age (% of children under 5)",
98820,France,FRA,"Prevalence of stunting, height for age, female (% of children under 5)",
98821,France,FRA,"Prevalence of stunting, height for age, male (% of children under 5)",
98822,France,FRA,Prevalence of undernourishment (% of population),
98823,France,FRA,"Prevalence of underweight, weight for age (% of children under 5)",
98824,France,FRA,"Prevalence of underweight, weight for age, female (% of children under 5)",
98825,France,FRA,"Prevalence of underweight, weight for age, male (% of children under 5)",
98826,France,FRA,"Prevalence of wasting, weight for height (% of children under 5)",
98827,France,FRA,"Prevalence of wasting, weight for height, female (% of children under 5)",
98828,France,FRA,"Prevalence of wasting, weight for height, male (% of children under 5)",
98829,France,FRA,Price level ratio of PPP conversion factor (GDP) to market exchange rate,0.856846324
98830,France,FRA,"Primary completion rate, female (% of relevant age group)",
98831,France,FRA,"Primary completion rate, male (% of relevant age group)",
98832,France,FRA,"Primary completion rate, total (% of relevant age group)",92.93036652
98833,France,FRA,"Primary education, duration (years)",5.0
98834,France,FRA,"Primary education, pupils",3884560.0
98835,France,FRA,"Primary education, pupils (% female)",48.57904
98836,France,FRA,"Primary education, teachers",207216.0
98837,France,FRA,"Primary education, teachers (% female)",79.84084320000001
98838,France,FRA,Primary government expenditures as a proportion of original approved budget (%),
98839,France,FRA,"Primary income payments (BoP, current US$)",60306037511.0
98840,France,FRA,"Primary income receipts (BoP, current US$)",84786205242.0
98841,France,FRA,Primary school starting age (years),6.0
98842,France,FRA,Private credit bureau coverage (% of adults),
98843,France,FRA,"Probability of dying among adolescents ages 10-14 years (per 1,000)",0.7
98844,France,FRA,"Probability of dying among adolescents ages 15-19 years (per 1,000)",2.4
98845,France,FRA,"Probability of dying among children ages 5-9 years (per 1,000)",0.6
98846,France,FRA,"Probability of dying among youth ages 20-24 years (per 1,000)",3.6
98847,France,FRA,Procedures to build a warehouse (number),
98848,France,FRA,Procedures to register property (number),
98849,France,FRA,Profit tax (% of commercial profits),
98850,France,FRA,Progression to secondary school (%),
98851,France,FRA,"Progression to secondary school, female (%)",
98852,France,FRA,"Progression to secondary school, male (%)",
98853,France,FRA,Proportion of people living below 50 percent of median income (%),9.7
98854,France,FRA,Proportion of population pushed below the $1.90 ($ 2011 PPP) poverty line by out-of-pocket health care expenditure (%),
98855,France,FRA,Proportion of population pushed below the $3.20 ($ 2011 PPP) poverty line by out-of-pocket health care expenditure (%),
98856,France,FRA,Proportion of population spending more than 10% of household consumption or income on out-of-pocket health care expenditure (%),
98857,France,FRA,Proportion of population spending more than 25% of household consumption or income on out-of-pocket health care expenditure (%),
98858,France,FRA,Proportion of seats held by women in national parliaments (%),10.91854419
98859,France,FRA,"Proportion of time spent on unpaid domestic and care work, female (% of 24 hour day)",
98860,France,FRA,"Proportion of time spent on unpaid domestic and care work, male (% of 24 hour day)",
98861,France,FRA,Proportion of women subjected to physical and/or sexual violence in the last 12 months (% of women age 15-49),
98862,France,FRA,"Public and publicly guaranteed debt service (% of exports of goods, services and primary income)",
98863,France,FRA,Public and publicly guaranteed debt service (% of GNI),
98864,France,FRA,Public credit registry coverage (% of adults),
98865,France,FRA,Public private partnerships investment in energy (current US$),
98866,France,FRA,Public private partnerships investment in ICT (current US$),
98867,France,FRA,Public private partnerships investment in transport (current US$),
98868,France,FRA,Public private partnerships investment in water and sanitation (current US$),
98869,France,FRA,Pump price for diesel fuel (US$ per liter),0.82
98870,France,FRA,Pump price for gasoline (US$ per liter),0.99
98871,France,FRA,"Pupil-teacher ratio, lower secondary",13.75676
98872,France,FRA,"Pupil-teacher ratio, preprimary",
98873,France,FRA,"Pupil-teacher ratio, primary",18.74643
98874,France,FRA,"Pupil-teacher ratio, secondary",11.79826
98875,France,FRA,"Pupil-teacher ratio, tertiary",17.1169
98876,France,FRA,"Pupil-teacher ratio, upper secondary",10.00528
98877,France,FRA,"Quality of port infrastructure, WEF (1=extremely underdeveloped to 7=well developed and efficient by international standards)",
98878,France,FRA,Rail lines (total route-km),29330.0
98879,France,FRA,"Railways, goods transported (million ton-km)",56167.0
98880,France,FRA,"Railways, passengers carried (million passenger-km)",70153.0
98881,France,FRA,Ratio of female to male labor force participation rate (%) (modeled ILO estimate),77.00925034
98882,France,FRA,Ratio of female to male labor force participation rate (%) (national estimate),77.98045379
98883,France,FRA,Real effective exchange rate index (2010 = 100),97.07051111
98884,France,FRA,Real interest rate (%),
98885,France,FRA,Refugee population by country or territory of asylum,132508.0
98886,France,FRA,Refugee population by country or territory of origin,74.0
98887,France,FRA,Renewable electricity output (% of total electricity output),12.96787647
98888,France,FRA,Renewable energy consumption (% of total final energy consumption),9.256000137000001
98889,France,FRA,Renewable internal freshwater resources per capita (cubic meters),
98890,France,FRA,"Renewable internal freshwater resources, total (billion cubic meters)",
98891,France,FRA,"Repeaters, primary, female (% of female enrollment)",
98892,France,FRA,"Repeaters, primary, male (% of male enrollment)",
98893,France,FRA,"Repeaters, primary, total (% of total enrollment)",4.165
98894,France,FRA,Research and development expenditure (% of GDP),2.09346
98895,France,FRA,Researchers in R&D (per million people),2915.69466
98896,France,FRA,"Reserves and related items (BoP, current US$)",-2436427992.0
98897,France,FRA,"Revenue, excluding grants (% of GDP)",42.80721095
98898,France,FRA,"Revenue, excluding grants (current LCU)",632941000000.0
98899,France,FRA,Risk of catastrophic expenditure for surgical care (% of people at risk),
98900,France,FRA,Risk of impoverishing expenditure for surgical care (% of people at risk),
98901,France,FRA,"Risk premium on lending (lending rate minus treasury bill rate, %)",
98902,France,FRA,Rural land area (sq. km),457993.5938
98903,France,FRA,Rural land area where elevation is below 5 meters (% of total land area),1.047872293
98904,France,FRA,Rural land area where elevation is below 5 meters (sq. km),5705.210449
98905,France,FRA,Rural population,14697577.0
98906,France,FRA,Rural population (% of total population),24.129
98907,France,FRA,Rural population growth (annual %),-0.374550014
98908,France,FRA,Rural population living in areas where elevation is below 5 meters (% of total population),0.7985925
98909,France,FRA,S&P Global Equity Indices (annual % change),-6.906747755
98910,France,FRA,"School enrollment, preprimary (% gross)",108.326828
98911,France,FRA,"School enrollment, preprimary, female (% gross)",108.3275909
98912,France,FRA,"School enrollment, preprimary, male (% gross)",108.3261108
98913,France,FRA,"School enrollment, primary (% gross)",100.4282608
98914,France,FRA,"School enrollment, primary (% net)",95.59312
98915,France,FRA,"School enrollment, primary (gross), gender parity index (GPI)",0.9907400009999999
98916,France,FRA,"School enrollment, primary and secondary (gross), gender parity index (GPI)",0.996110022
98917,France,FRA,"School enrollment, primary, female (% gross)",99.95005035
98918,France,FRA,"School enrollment, primary, female (% net)",95.72176999999999
98919,France,FRA,"School enrollment, primary, male (% gross)",100.88426209999999
98920,France,FRA,"School enrollment, primary, male (% net)",95.47044
98921,France,FRA,"School enrollment, primary, private (% of total primary)",14.55632019
98922,France,FRA,"School enrollment, secondary (% gross)",105.5902176
98923,France,FRA,"School enrollment, secondary (% net)",89.91505
98924,France,FRA,"School enrollment, secondary (gross), gender parity index (GPI)",0.999549985
98925,France,FRA,"School enrollment, secondary, female (% gross)",105.56585690000001
98926,France,FRA,"School enrollment, secondary, female (% net)",90.68465
98927,France,FRA,"School enrollment, secondary, male (% gross)",105.61357120000001
98928,France,FRA,"School enrollment, secondary, male (% net)",89.17741
98929,France,FRA,"School enrollment, secondary, private (% of total secondary)",25.03117943
98930,France,FRA,"School enrollment, tertiary (% gross)",50.60308075
98931,France,FRA,"School enrollment, tertiary (gross), gender parity index (GPI)",1.17640996
98932,France,FRA,"School enrollment, tertiary, female (% gross)",55.56650925
98933,France,FRA,"School enrollment, tertiary, male (% gross)",45.76396942
98934,France,FRA,Scientific and technical journal articles,49691.91
98935,France,FRA,"Secondary education, duration (years)",7.0
98936,France,FRA,"Secondary education, general pupils",4422962.0
98937,France,FRA,"Secondary education, general pupils (% female)",50.54075
98938,France,FRA,"Secondary education, pupils",5928745.0
98939,France,FRA,"Secondary education, pupils (% female)",48.9284
98940,France,FRA,"Secondary education, teachers",502510.0
98941,France,FRA,"Secondary education, teachers (% female)",55.20486832
98942,France,FRA,"Secondary education, teachers, female",277410.0
98943,France,FRA,"Secondary education, vocational pupils",1505783.0
98944,France,FRA,"Secondary education, vocational pupils (% female)",44.19242
98945,France,FRA,"Secondary income receipts (BoP, current US$)",7397291666.0
98946,France,FRA,"Secondary income, other sectors, payments (BoP, current US$)",17984063234.0
98947,France,FRA,Secure Internet servers,
98948,France,FRA,Secure Internet servers (per 1 million people),
98949,France,FRA,"Self-employed, female (% of female employment) (modeled ILO estimate)",8.270999908
98950,France,FRA,"Self-employed, male (% of male employment) (modeled ILO estimate)",13.93999958
98951,France,FRA,"Self-employed, total (% of total employment) (modeled ILO estimate)",11.411999699999999
98952,France,FRA,"Service exports (BoP, current US$)",96662707583.0
98953,France,FRA,"Service imports (BoP, current US$)",84600825698.0
98954,France,FRA,"Services, value added (% of GDP)",66.31110149
98955,France,FRA,"Services, value added (annual % growth)",3.590475801
98956,France,FRA,"Services, value added (constant 2010 US$)",1597430000000.0
98957,France,FRA,"Services, value added (constant LCU)",1236700000000.0
98958,France,FRA,"Services, value added (current LCU)",980466000000.0
98959,France,FRA,"Services, value added (current US$)",903322000000.0
98960,France,FRA,"Services, value added per worker (constant 2010 US$)",93453.0963
98961,France,FRA,Sex ratio at birth (male births per female births),
98962,France,FRA,SF6 gas emissions (thousand metric tons of CO2 equivalent),2428.5
98963,France,FRA,"Share of tariff lines with international peaks, all products (%)",5.201421
98964,France,FRA,"Share of tariff lines with international peaks, manufactured products (%)",0.2994668
98965,France,FRA,"Share of tariff lines with international peaks, primary products (%)",18.208470000000002
98966,France,FRA,"Share of tariff lines with specific rates, all products (%)",1.241456
98967,France,FRA,"Share of tariff lines with specific rates, manufactured products (%)",0.0218998
98968,France,FRA,"Share of tariff lines with specific rates, primary products (%)",4.477139
98969,France,FRA,"Share of youth not in education, employment or training, female (% of female youth population)",
98970,France,FRA,"Share of youth not in education, employment or training, male (% of male youth population)",
98971,France,FRA,"Share of youth not in education, employment or training, total (% of youth population)",
98972,France,FRA,"Short-term debt (% of exports of goods, services and primary income)",
98973,France,FRA,Short-term debt (% of total external debt),
98974,France,FRA,Short-term debt (% of total reserves),
98975,France,FRA,"Smoking prevalence, females (% of adults)",30.3
98976,France,FRA,"Smoking prevalence, males (% of adults)",39.8
98977,France,FRA,"Smoking prevalence, total (ages 15+)",34.9
98978,France,FRA,Social contributions (% of revenue),40.6519723
98979,France,FRA,Social contributions (current LCU),257303000000.0
98980,France,FRA,Source data assessment of statistical capacity (scale 0 - 100),
98981,France,FRA,"Specialist surgical workforce (per 100,000 population)",
98982,France,FRA,Start-up procedures to register a business (number),
98983,France,FRA,"Start-up procedures to register a business, female (number)",
98984,France,FRA,"Start-up procedures to register a business, male (number)",
98985,France,FRA,Statistical Capacity score (Overall average),
98986,France,FRA,"Stocks traded, total value (% of GDP)",79.30278732
98987,France,FRA,"Stocks traded, total value (current US$)",1080300000000.0
98988,France,FRA,"Stocks traded, turnover ratio of domestic shares (%)",74.67689066
98989,France,FRA,Strength of legal rights index (0=weak to 12=strong),
98990,France,FRA,Subsidies and other transfers (% of expense),49.99199746
98991,France,FRA,Subsidies and other transfers (current LCU),326219000000.0
98992,France,FRA,"Suicide mortality rate (per 100,000 population)",22.3
98993,France,FRA,"Suicide mortality rate, female (per 100,000 female population)",14.4
98994,France,FRA,"Suicide mortality rate, male (per 100,000 male population)",30.5
98995,France,FRA,Surface area (sq. km),549086.9922
98996,France,FRA,"Survey mean consumption or income per capita, bottom 40% of population (2011 PPP $ per day)",
98997,France,FRA,"Survey mean consumption or income per capita, total population (2011 PPP $ per day)",
98998,France,FRA,"Survival to age 65, female (% of cohort)",90.76916159999999
98999,France,FRA,"Survival to age 65, male (% of cohort)",79.7374344
99000,France,FRA,"Tariff rate, applied, simple mean, all products (%)",3.17
99001,France,FRA,"Tariff rate, applied, simple mean, manufactured products (%)",2.24
99002,France,FRA,"Tariff rate, applied, simple mean, primary products (%)",7.76
99003,France,FRA,"Tariff rate, applied, weighted mean, all products (%)",2.27
99004,France,FRA,"Tariff rate, applied, weighted mean, manufactured products (%)",2.01
99005,France,FRA,"Tariff rate, applied, weighted mean, primary products (%)",2.94
99006,France,FRA,"Tariff rate, most favored nation, simple mean, all products (%)",6.19
99007,France,FRA,"Tariff rate, most favored nation, simple mean, manufactured products (%)",4.54
99008,France,FRA,"Tariff rate, most favored nation, simple mean, primary products (%)",12.0
99009,France,FRA,"Tariff rate, most favored nation, weighted mean, all products (%)",3.45
99010,France,FRA,"Tariff rate, most favored nation, weighted mean, manufactured products (%)",3.1
99011,France,FRA,"Tariff rate, most favored nation, weighted mean, primary products (%)",4.34
99012,France,FRA,Tax payments (number),
99013,France,FRA,Tax revenue (% of GDP),23.50314659
99014,France,FRA,Tax revenue (current LCU),347514000000.0
99015,France,FRA,Taxes less subsidies on products (constant LCU),205112000000.0
99016,France,FRA,Taxes less subsidies on products (current LCU),152244000000.0
99017,France,FRA,Taxes less subsidies on products (current US$),140265000000.0
99018,France,FRA,Taxes on exports (% of tax revenue),
99019,France,FRA,Taxes on exports (current LCU),
99020,France,FRA,Taxes on goods and services (% of revenue),25.87334364
